Smile,79%,77%,Parker Finn,"Marty Bowen, Wyck Godfrey, Isaac Klausner, Robert Salerno",Parker Finn,Paramount Pictures,"Paramount Players, Temple Hill Entertainment",R,"Horror, Mystery & Thriller",English,"Sep 30, 2022, Wide",15-Nov-22,$105.9M,1h 56m,,,"Parker Finn, Sosie Bacon, Jessie T. Usher, Kyle Gallner, Robin Weigert, Caitlin Stasey"
Miller's Girl,29%,45%,Jade Halley Bartlett,"Seth Rogen, Evan Goldberg, James Weaver, Josh Fagen, Mary-Margaret Kunze",Jade Halley Bartlett,Lionsgate,"Good Universe, Point Grey Pictures Inc., Lions Gate Films",R (Sexual Content|Language Throughout|Some Teen Smoking and Drinking),"Comedy, Drama, Mystery & Thriller",English,"Jan 26, 2024, Wide",16-Feb-24,$282.0K,1h 33m,,,"Jade Halley Bartlett, Jenna Ortega, Martin Freeman, Bashir Salahuddin, Gideon Adlon, Dagmara Domińczyk"
High Art,76%,77%,Lisa Cholodenko,"Dolly Hall, Jeffrey Kusama-Hinte, Susan A. Stover",Lisa Cholodenko,,"391 Productions, October Films, Antidote Films",R,"Drama, LGBTQ+",English,,10-Sep-15,$1.9M,1h 42m,Surround,,"Lisa Cholodenko, Ally Sheedy, Radha Mitchell, Patricia Clarkson, Tammy Grimes, Gabriel Mann"
DASHCAM,47%,35%,Rob Savage,"Jason Blum, Douglas Cox",Rob Savage,Momentum Pictures,"Blumhouse Productions, Shadowhouse Films",R (Pervasive Language|Crude Sexual References|Bloody Violence),Horror,English,"Jun 3, 2022, Limited",3-Jun-22,,1h 17m,,,"Rob Savage, Annie Hardy, Faith Kiggundu, Seylan Baxter, Amar Chadha-Patel, Angela Enahoro"
Dirty Dancing,72%,90%,Emile Ardolino,Linda Gottlieb,Eleanor Bergstein,Artisan Entertainment,Vestron Pictures,PG-13,"Romance, Drama",English,"Aug 25, 1987, Wide",17-Dec-15,$486.3K,1h 40m,Surround,,"Emile Ardolino, Jennifer Grey, Patrick Swayze, Jerry Orbach, Cynthia Rhodes, Jack Weston"
A Quiet Place: Day One,86%,72%,Michael Sarnoski,"Michael Bay, Andrew Form, Brad Fuller, John Krasinski",Michael Sarnoski,Paramount Pictures,"Platinum Dunes, Sunday Night",PG-13 (Violent Content/Bloody Images|Terror),"Horror, Sci-Fi, Mystery & Thriller",English,"Jun 28, 2024, Wide",30-Jul-24,$138.9M,1h 40m,"Dolby Atmos, Dolby Digital",Digital 2.39:1,"Michael Sarnoski, Lupita Nyong'o, Joseph Quinn, Alex Wolff, Djimon Hounsou, Jennifer Woodward"
Collateral,86%,84%,Michael Mann,"Michael Mann, Julie Richardson","Stuart Beattie, Stuart Beattie, Frank Darabont, Michael Mann",DreamWorks SKG,"Edge City LLC, Paramount Pictures, Forward Pass, DreamWorks SKG",R (Violence|Language),"Mystery & Thriller, Crime, Drama",English,"Aug 5, 2004, Original",1-Aug-14,$100.0M,2h 0m,"SDDS, DTS, Stereo, Surround, Dolby Digital, Dolby SRD",Scope (2.35:1),"Michael Mann, Tom Cruise, Jamie Foxx, Jada Pinkett Smith, Mark Ruffalo, Peter Berg"
Bodies Bodies Bodies,86%,69%,Halina Reijn,"David Hinojosa, Ali Herting",Sarah DeLappe,A24,"2AM, A24",R (Drug Use|Bloody Images|Pervasive Language|Sexual References|Violence),"Mystery & Thriller, Horror, Comedy, Drama",English,"Aug 12, 2022, Wide",,$10.7M,1h 35m,,Scope (2.35:1),"Halina Reijn, Amandla Stenberg, Maria Bakalova, Myha'la Herrold, Chase Sui Wonders, Rachel Sennott"
The Women,13%,38%,Diane English,"Victoria Pearman, Mick Jagger, Bill Johnson, Diane English",Diane English,Picturehouse,"Jagged Films, Inferno Distribution, Shukovsky English",PG-13 (Language|Brief Smoking|Sex-Related Material|Some Drug Use),"Comedy, Drama",English,"Sep 12, 2008, Wide",1-Nov-10,$26.9M,1h 54m,,,"Diane English, Meg Ryan, Annette Bening, Eva Mendes, Debra Messing, Jada Pinkett Smith"
The Super Mario Bros. Movie,59%,95%,"Aaron Horvath, Michael Jelenic","Christopher Meledandri, Shigeru Miyamoto",Matthew Fogel,Universal Pictures,"Illumination Entertainment, Universal Pictures, Nintendo",PG (Action and Mild Violence),"Kids & Family, Comedy, Adventure, Animation",English,"Apr 5, 2023, Wide",16-May-23,$574.9M,1h 32m,"Dolby Digital, DTS, Dolby Atmos",Digital 2.39:1,"Aaron Horvath, Michael Jelenic, Chris Pratt, Anya Taylor-Joy, Charlie Day, Jack Black"
Fantastic Beasts: The Secrets of Dumbledore,46%,83%,David Yates,"David Heyman, Steve Kloves, Tim Lewis, J.K. Rowling, Lionel Wigram","J.K. Rowling, Steve Kloves",Warner Bros. Pictures,"Heyday Films, Warner Bros.",PG-13 (Some Fantasy Action/Violence),"Fantasy, Adventure",British English,"Apr 15, 2022, Wide",30-May-22,$95.8M,2h 22m,"Dolby Atmos, Dolby Digital, DTS",,"David Yates, Eddie Redmayne, Jude Law, Mads Mikkelsen, Ezra Miller, Dan Fogler"
The Last Seduction,94%,76%,John Dahl,Jonathan Shestack,Steve Barancik,October Films,Incorporated Television Company,R,Mystery & Thriller,English,"Oct 26, 1994, Wide",24-Jul-18,$1.8M,1h 50m,"Surround, Stereo, Ultra-Stereo",,"John Dahl, Linda Fiorentino, Peter Berg, Bill Pullman, J.T. Walsh, Bill Nunn"
The Menu,88%,76%,Mark Mylod,"Adam McKay, Betsy Koch, Will Ferrell","Seth Reiss, Will Tracy",Searchlight Pictures,"Hyperobject Industries, Searchlight Pictures",R (Some Sexual References|Language Throughout|Strong Violent Content),"Horror, Mystery & Thriller, Comedy",English,"Nov 18, 2022, Wide",3-Jan-23,$38.5M,1h 47m,"Dolby Atmos, Dolby Digital",Digital 2.39:1,"Mark Mylod, Ralph Fiennes, Anya Taylor-Joy, Nicholas Hoult, Hong Chau, Janet McTeer"
The Pink Panther,21%,51%,Shawn Levy,Robert Simonds,"Len Blum, Steve Martin",Metro-Goldwyn-Mayer,Metro Goldwyn Mayer,PG (Occasional Crude Humor|Language|Suggestive Humor),Comedy,English,"Feb 10, 2006, Wide",12-Jan-17,$82.2M,1h 33m,"Dolby Digital, DTS, SDDS",Flat (1.85:1),"Shawn Levy, Steve Martin, Kevin Kline, Beyoncé, Jean Reno, Emily Mortimer"
Rollerball,67%,62%,Norman Jewison,Norman Jewison,"William Harrison, William Harrison",United Artists,"Algonquin, United Artists",R,"Sci-Fi, Action",English,"Jan 1, 1975, Wide",16-Sep-08,,2h 8m,Stereo,Flat (1.85:1),"Norman Jewison, James Caan, John Houseman, Maud Adams, John Beck, Moses Gunn"
Whiplash,94%,94%,Damien Chazelle,"Helen Estabrook, Jason Blum, Michel Litvak, David Lancaster",Damien Chazelle,Sony Pictures Classics,"Blumhouse, Bold Films, Right of Way Films",R (Strong Language|Some Sexual References),"Drama, Music",English,"Oct 10, 2014, Limited",8-Sep-16,$911.4K,1h 46m,"Datasat, SDDS, Dolby Digital",,"Damien Chazelle, Miles Teller, J.K. Simmons, Melissa Benoist, Paul Reiser, Austin Stowell"
The Lodge,75%,51%,"Veronika Franz, Severin Fiala","Simon Oakes, Aaron Ryder, Aliza James","Sergio Casci, Veronika Franz, Severin Fiala",Neon,"Hammer Films, FilmNation",R (Language and Brief Nudity|Disturbing Violence|Some Bloody Images),"Horror, Mystery & Thriller",English,"Feb 7, 2020, Limited",3-May-20,$2.1M,1h 48m,,Flat (1.85:1),"Veronika Franz, Severin Fiala, Riley Keough, Jaeden Martell, Lia McHugh, Richard Armitage"
Fight Club,81%,96%,David Fincher,"Ross Grayson Bell, Ceán Chaffin, Art Linson","Chuck Palahniuk, Jim Uhls",20th Century Fox,"Art Linson Productions, Fox 2000 Pictures, Taurus Film, New Regency Pictures",R (Disturbing Behavior|Anti-Social Behavior|Violent Behavior|Graphic Behavior|Language|Sexuality),"Mystery & Thriller, Drama",English,"Oct 15, 1999, Wide",19-Nov-14,$37.0M,2h 19m,"Dolby SR, Dolby EX, DTS, Dolby Stereo, SDDS, DTS-ES, Dolby A, Surround, Dolby Digital",Scope (2.35:1),"David Fincher, Brad Pitt, Edward Norton, Helena Bonham Carter, Meat Loaf, Jared Leto"
Any Given Sunday,52%,73%,Oliver Stone,"Dan Halsted, Lauren Shuler Donner, Clayton Townsend","Oliver Stone, Daniel Pyne, John Logan, John Logan",Warner Bros. Pictures,"Donners' Company, Warner Brothers, Illusion Entertainment, Ixtlan Corporation",R (Language|Nudity|Drug Content|Sexuality),Drama,English,"Dec 22, 1999, Wide",27-Sep-10,$75.5M,2h 42m,"Dolby Digital, SDDS, Surround, DTS",Scope (2.35:1),"Oliver Stone, Al Pacino, Cameron Diaz, Dennis Quaid, James Woods, Jamie Foxx"
Dr. Strangelove Or: How I Learned to Stop Worrying and Love the Bomb,98%,94%,Stanley Kubrick,Stanley Kubrick,"Stanley Kubrick, Terry Southern, Peter George",Columbia Pictures,Hawk Films,PG,Comedy,English,"Jan 29, 1964, Wide",16-Apr-12,,1h 33m,Mono,Flat (1.85:1),"Stanley Kubrick, Peter Sellers, George C. Scott, Keenan Wynn, Slim Pickens, Peter Bull"
Racing Dreams,100%,93%,Marshall Curry,"Bristol Baughan, Marshall Curry",Marshall Curry,Hannover House,,PG (Brief Language|Some Thematic Elements),Documentary,English,"May 21, 2010, Limited",7-Sep-12,$55.6K,1h 37m,,,"Marshall Curry, Annabeth Barnes, Marshall Curry, Benjamin Goldhirsh, Dany Garcia, Dwayne Johnson"
Elisa & Marcela,47%,50%,Isabel Coixet,,,,,,,,,,,,,,"Isabel Coixet, Natalia de Molina, Greta Fernández, Sara Casasnovas, Tamar Novas"
A Royal Affair,90%,82%,Nikolaj Arcel,"Jessica Ask, Gillian Berrie, Anna Duffield, Meta Louise Foldager, Sisse Graum Jørgensen, Madeleine Ekman","Rasmus Heisterberg, Nikolaj Arcel",Magnolia Pictures,Zentropa Entertainment,R (Some Violent Images|Sexual Content),"Drama, Romance, History",Danish,"Nov 9, 2012, Limited",2-Mar-17,$1.5M,2h 17m,,,"Nikolaj Arcel, Mads Mikkelsen, Alicia Vikander, David Dencik, Trine Dyrholm, Thomas W. Gabrielsson"
The Guardians of the Galaxy Holiday Special,94%,81%,James Gunn,,James Gunn,,,,"Action, Adventure, Comedy, Holiday",English,,25-Nov-22,,44m,,,"James Gunn, Chris Pratt, Dave Bautista, Karen Gillan, Zoe Saldana, Bradley Cooper"
Inception,87%,91%,Christopher Nolan,"Christopher Nolan, Emma Thomas",Christopher Nolan,Warner Bros. Pictures,"Syncopy, Warner Bros.",PG-13 (Sequences of Violence|Sequences of Action),"Sci-Fi, Mystery & Thriller, Action",English,"Jul 16, 2010, Wide",20-Jun-13,$292.6M,2h 28m,"DTS, Dolby Digital, SDDS",Scope (2.35:1),"Christopher Nolan, Leonardo DiCaprio, Joseph Gordon-Levitt, Elliot Page, Tom Hardy, Ken Watanabe"
Hatching,92%,59%,Hanna Bergholm,"Mika Ritalahti, Nico Ritalahti, Nima Yousefi",Ilja Rautsi,IFC Midnight,"The Searchers NV, Film i Väst, Silva Mysterium Oy, Umedia, Hobab, Evil Doghouse Productions",,Horror,Finnish,"Apr 29, 2022, Limited",17-May-22,$182.8K,1h 27m,,Flat (1.85:1),"Hanna Bergholm, Siiri Solalinna, Sophia Heikkilä, Jani Volanen, Oiva Ollila, Reino Nordin"
The Dreamers,59%,78%,Bernardo Bertolucci,Jeremy Thomas,Gilbert Adair,Fox,Recorded Pictures Company,NC-17,Drama,English,"Feb 6, 2004, Wide",1-May-17,$2.5M,1h 56m,"Surround, Dolby SR",Flat (1.85:1),"Bernardo Bertolucci, Michael Pitt, Eva Green, Louis Garrel, Robin Renucci, Anna Chancellor"
Prey for the Devil,15%,69%,Daniel Stamm,"Paul Brooks, Todd R. Jones, Earl Richey Jones, Jessica Malanaphy","Robert Zappia, Earl Richey Jones, Todd R. Jones",Lionsgate,"Lionsgate, Gold Circle Films",PG-13 (Terror|Brief Language|Thematic Elements|Violent and Disturbing Content),"Horror, Mystery & Thriller",English,"Oct 28, 2022, Wide",13-Dec-22,$19.8M,1h 33m,Dolby Digital,Scope (2.35:1),"Daniel Stamm, Jacqueline Byers, Colin Salmon, Christian Navarro, Lisa Palfrey, Nicholas Ralph"
Beau Is Afraid,68%,71%,Ari Aster,"Lars Knudsen, Ari Aster",Ari Aster,A24,"MTL Grandé Studios, A24, IPR.VC, Access Entertainment, Square Peg",R (Graphic Nudity|Drug Use|Language|Sexual Content|Strong Violent Content),"Adventure, Horror, Mystery & Thriller, Comedy, Drama",English,"Apr 21, 2023, Wide",13-Jun-23,$8.1M,2h 59m,Dolby Digital,Flat (1.85:1),"Ari Aster, Joaquin Phoenix, Nathan Lane, Amy Ryan, Parker Posey, Patti LuPone"
Tokyo Godfathers,92%,91%,Satoshi Kon,Masao Maruyama,,"Sony Pictures Entertainment, Columbia Tristar, Samuel Goldwyn Company",Mad House Company Ltd.,PG-13 (Thematic Elements|Some Sexual Material|Language|Violent Images),"Comedy, Drama, Anime",Japanese,"Aug 30, 2003, Original",2-Dec-17,$129.0K,1h 30m,Surround,,"Satoshi Kon, Yoshiaki Umegaki, Aya Okamoto, Toru Emori, Shinichi Kobayashi, Taro Maki"
Silent Night,66%,47%,Camille Griffin,"Celine Rattray, Trudie Styler, Matthew Vaughn",Camille Griffin,RLJE Films,Marv Films,,"Horror, Drama, Comedy",British English,"Dec 3, 2021, Limited",3-Dec-21,,1h 32m,,,"Camille Griffin, Keira Knightley, Matthew Goode, Roman Griffin Davis, Annabelle Wallis, Lily-Rose Depp"
Orphan: First Kill,70%,77%,William Brent Bell,"Ethan Erwin, Alex Mace, Hal Sadoff, James Tomlinson",David Coggeshall,Paramount Players,"Entertainment One, Dark Castle Entertainment",R (Brief Sexual Content|Bloody Violence|Language),"Horror, Mystery & Thriller",English,"Aug 19, 2022, Wide",19-Aug-22,$5.4M,1h 39m,Dolby Digital,Flat (1.85:1),"William Brent Bell, Isabelle Fuhrman, Julia Stiles, Rossif Sutherland, Matthew Finlan, Hiro Kanagawa"
The Conversation,93%,89%,Francis Ford Coppola,Francis Ford Coppola,Francis Ford Coppola,Paramount Pictures,"The Directors Company, American Zoetrope",PG,Mystery & Thriller,English,"Apr 7, 1974, Original",1-Oct-11,$143.4K,1h 53m,,,"Francis Ford Coppola, Gene Hackman, John Cazale, Frederic Forrest, Allen Garfield, Cindy Williams"
Homebound,67%,27%,Sebastian Godwin,"Hugo Godwin, Emma Parsons",Sebastian Godwin,Brainstorm Media,"SUMS Film and Media, BFI Film Fund, Microwave, East Green Films, Sharp House",,"Mystery & Thriller, Horror",English,"May 13, 2022, Limited",13-May-22,,1h 11m,,Scope (2.35:1),"Sebastian Godwin, Aisling Loftus, Tom Goodman-Hill, Hattie Gotobed, Raffiella Chapman, Lukas Rolfe"
The Harbinger,63%,76%,Will Klipstine,"Steven Reed C., Will Klipstine, Amy Mills, Craig Muckler","Will Klipstine, Amy Mills",Screen Media,"Singing River Productions, Veteran Films",PG-13 (Violence|Thematic Content|Suicide),"Horror, Mystery & Thriller",English,"Sep 2, 2022, Limited",2-Sep-22,,1h 55m,,Scope (2.35:1),"Will Klipstine, Irene Bedard, Madeleine McGraw, Steve Monroe, Will Klipstine, Charles Hubbell"
Mr. Harrigan's Phone,46%,51%,John Lee Hancock,"Jason Blum, Ryan Murphy, Carla Hacken",John Lee Hancock,,"Blumhouse Productions, Ryan Murphy Productions",PG-13,Horror,English,,5-Oct-22,,1h 44m,,,"John Lee Hancock, Donald Sutherland, Jaeden Martell, Joe Tippett, Kirby, Cyrus Arnold"
Plane,79%,94%,Jean-François Richet,"Lorenzo di Bonaventura, Mark Vahradian, Marc Butan, Gerard Butler, Alan Siegel, Jason Constantine, Eda Kowan, Ara Keshishian","Charles Cumming, J.P. Davis",Lionsgate,"G-BASE, MadRiver Pictures, Di Bonaventura Pictures, Olive Hill Media, The Searchers NV",R (Violence and Language),"Action, Adventure, Mystery & Thriller",English,"Jan 13, 2023, Wide",2-Feb-23,$32.1M,1h 47m,,Scope (2.35:1),"Jean-François Richet, Gerard Butler, Mike Colter, Yoson An, Daniella Pineda, Paul Ben-Victor"
Intimacy,66%,58%,Patrice Chéreau,"Patrick Cassavetti, Jacques Hinstin","Anne-Louise Trividic, Patrice Chéreau",,"Mikado Films, Company Credits, Arte France Cinema, Canal+, Greenpoint Films, StudioCanal, Bac Films, Téléma, France 2 Cinéma, Azor Films, Westdeutscher Rundfunk",R,Drama,English,,,$563.6K,1h 59m,Surround,,"Patrice Chéreau, Mark Rylance, Kerry Fox, Timothy Spall, Alastair Galbraith, Philippe Calvario"
Elevation,53%,80%,George Nolfi,"Brad Fuller, Alex Black, John Glenn, Anthony Mackie, George Nolfi, Natalie Sellers, Joel Viertel","John Glenn, Jacob Roman, Kenny Ryan",Vertical,Lyrical Media,R (Language),"Sci-Fi, Action, Mystery & Thriller, Drama",English,"Nov 8, 2024, Wide",26-Nov-24,,1h 30m,,,"George Nolfi, Anthony Mackie, Morena Baccarin, Maddie Hasson, Danny Boyd Jr., Shauna Earp"
Killers of the Flower Moon,93%,84%,Martin Scorsese,"Martin Scorsese, Dan Friedkin, Bradley Thomas, Daniel Lupi","Eric Roth, Martin Scorsese",Paramount Pictures,"Appian Way, Apple Studios, Sikelia Productions, Imperative Entertainment",R (Some Grisly Images|Language|Violence),"Crime, Drama",English,"Oct 20, 2023, Wide",5-Dec-23,$68.0M,3h 26m,"Dolby Atmos, Dolby Digital",Digital 2.39:1,"Martin Scorsese, Leonardo DiCaprio, Robert De Niro, Jesse Plemons, Lily Gladstone, Tantoo Cardinal"
Unfaithful,50%,68%,Adrian Lyne,"Adrian Lyne, G. Mac Brown","Alvin Sargent, William Broyles Jr., Claude Chabrol",20th Century Fox,Regency Enterprises,R (Scene of Violence|Language|Sexuality),"Drama, Mystery & Thriller",English,"May 10, 2002, Wide",14-Aug-15,$52.8M,2h 4m,"Dolby Stereo, Dolby Digital, Dolby A, Surround, Dolby SR",Flat (1.85:1),"Adrian Lyne, Richard Gere, Diane Lane, Olivier Martinez, Erik Per Sullivan, Željko Ivanek"
Yojimbo,96%,96%,Akira Kurosawa,Akira Kurosawa,"Ryûzô Kikushima, Akira Kurosawa",,Toho Company Ltd.,,"Adventure, Comedy, Mystery & Thriller",Japanese,"Oct 15, 1961, Wide",23-Mar-17,,1h 50m,Perspecta Stereo,Scope (2.35:1),"Akira Kurosawa, Toshiro Mifune, Tatsuya Nakadai, Eijiro Tono, Takashi Shimura, Seizaburô Kawazu"
Bound,87%,83%,"Lilly Wachowski, Lana Wachowski","Andrew Lazar, Stuart Boros","Lilly Wachowski, Lana Wachowski",Gramercy Pictures,Dino De Laurentiis Productions,R,"Mystery & Thriller, LGBTQ+",English,"Oct 4, 1996, Original",5-Nov-16,$3.8M,1h 48m,Surround,,"Lilly Wachowski, Lana Wachowski, Jennifer Tilly, Gina Gershon, Joe Pantoliano, Barry Kivel"
Wallace & Gromit: Vengeance Most Fowl,100%,,"Merlin Crossingham, Nick Park","Richard Beek, Claire Jennings","Mark Burton, Nick Park",Netflix,Aardman Animations,PG,"Kids & Family, Comedy, Adventure, Animation",English,"Dec 18, 2024, Limited",3-Jan-25,,1h 19m,Dolby Digital,,"Merlin Crossingham, Nick Park, Ben Whitehead, Peter Kay, Lauren Patel, Reece Shearsmith"
Me Before You,54%,73%,Thea Sharrock,"Karen Rosenfelt, Alison Owen",Jojo Moyes,Warner Bros. Pictures,"New Line Cinema, Metro-Goldwyn-Mayer",PG-13 (Thematic Elements|Some Suggestive Material),"Romance, Drama",English,"Jun 3, 2016, Wide",16-Aug-16,$56.2M,1h 50m,,,"Thea Sharrock, Emilia Clarke, Sam Claflin, Janet McTeer, Charles Dance, Matthew Lewis"
Rare Exports: A Christmas Tale,89%,70%,Jalmari Helander,"Petri Jokiranta, Knut Skoglund",Jalmari Helander,Oscilloscope Pictures,Yleisradio,R (Some Nudity|Language),"Holiday, Adventure, Horror, Comedy",Finnish,"Dec 3, 2010, Limited",24-Jul-12,$263.2K,1h 24m,Dolby Digital,,"Jalmari Helander, Onni Tommila, Jorma Tommila, Ilmari Järvenpää, Peeter Jakobi, Tommi Korpela"
We Live in Time,78%,83%,John Crowley,"Adam Ackland, Leah Clarke, Guy Heeley",Nick Payne,A24,"SunnyMarch, Shoebox Films",R,"Drama, Romance",English,"Oct 18, 2024, Wide",22-Nov-24,,1h 48m,Dolby Digital,Digital 2.39:1,"John Crowley, Andrew Garfield, Florence Pugh, Adam James, Aoife Hinds, Marama Corlett"
Saving Private Ryan,94%,95%,Steven Spielberg,"Ian Bryce, Mark Gordon, Gary Levinsohn, Steven Spielberg",Robert Rodat,"Paramount Pictures, DreamWorks SKG","DreamWorks SKG, Mutual Film Company, Amblin Entertainment, Paramount Pictures, Mark Gordon Productions",R (Graphic Sequences of War|Graphic Sequences of Violence|Language),"War, History, Drama",English,"Jul 24, 1998, Wide",27-May-16,,2h 49m,"Dolby SR, DTS, Dolby Stereo, Surround, SDDS, Dolby A, Dolby Digital",Flat (1.85:1),"Steven Spielberg, Tom Hanks, Edward Burns, Tom Sizemore, Jeremy Davies, Vin Diesel"
Despicable Me 4,56%,87%,Chris Renaud,"Christopher Meledandri, Brett Hoffman","Mike White, Ken Daurio",Universal Pictures,Chris Meledandri,PG (Action and Rude Humor),"Kids & Family, Comedy, Adventure, Animation",English,"Jul 3, 2024, Wide",6-Aug-24,$361.0M,1h 35m,"SDDS, Dolby Digital, Dolby Atmos",Flat (1.85:1),"Chris Renaud, Steve Carell, Kristen Wiig, Pierre Coffin, Joey King, Miranda Cosgrove"
A Christmas Story,89%,89%,Bob Clark,"Bob Clark, René Dupont","Leigh Brown, Bob Clark, Jean Shepherd, Jean Shepherd",Metro-Goldwyn-Mayer,"Metro Goldwyn Mayer, Christmas Tree Films",PG,"Kids & Family, Holiday, Comedy",English,"Nov 18, 1983, Wide",25-Dec-11,$20.7M,1h 33m,Mono,Flat (1.85:1),"Bob Clark, Peter Billingsley, W. Lyle Richardson, Melinda Dillon, Ian Petrella, Scotty Schwartz"
The Instigators,40%,54%,Doug Liman,"Matt Damon, Ben Affleck, Jeff Robinov, John Graham, Kevin J. Walsh",Chuck MacLean,Apple TV+,"Apple TV+, The Walsh Company, Apple Original Films, Studio 8, Artists Equity, Apple Studios",R (Some Violence|Pervasive Language),"Action, Comedy, Crime, Mystery & Thriller",English,"Aug 2, 2024, Limited",9-Aug-24,,1h 41m,,,"Doug Liman, Matt Damon, Casey Affleck, Hong Chau, Michael Stuhlbarg, Paul Walter Hauser"
Creed II,83%,80%,Steven Caple Jr.,"Sylvester Stallone, Kevin King Templeton, Charles Winkler, William Chartoff, David Winkler, Irwin Winkler","Sylvester Stallone, Juel Taylor","Metro-Goldwyn-Mayer, Warner Bros. Pictures","Metro-Goldwyn-Mayer Studios, New Line Cinema, Warner Bros.",PG-13 (Language|A Scene of Sensuality|Sports Action Violence),"Drama, Action",English,"Nov 21, 2018, Wide",12-Feb-19,$115.7M,2h 10m,,Scope (2.35:1),"Steven Caple Jr., Michael B. Jordan, Sylvester Stallone, Tessa Thompson, Phylicia Rashad, Dolph Lundgren"
Cruel Intentions,54%,80%,Roger Kumble,Neal H. Moritz,Roger Kumble,"Columbia Pictures, Sony Pictures Entertainment","Columbia Pictures, Newmarket Capital Group",R (Language|Drug Use|Sexual Situations|Strong Sexual Dialogue),Drama,English,"Mar 5, 1999, Wide",28-Mar-14,$38.6M,1h 37m,"Dolby Stereo, Dolby A, SDDS, Surround, Dolby Digital, Dolby SR",Flat (1.85:1),"Roger Kumble, Sarah Michelle Gellar, Ryan Phillippe, Reese Witherspoon, Selma Blair, Louise Fletcher"
Blink,87%,80%,"Daniel Roher, Edmund Stenson","Melanie Miller, Diane Becker",,National Geographic Documentary Films,"Fishbowl Films, Media Rights Capital (MRC)",PG (Thematic Elements|Some Language|Brief Smoking),Documentary,English,"Oct 4, 2024, Limited",17-Dec-24,,1h 24m,,,"Daniel Roher, Edmund Stenson, Sébastien Pelletier, Melanie Miller, Diane Becker, Carolyn Bernstein"
Late Night with the Devil,97%,82%,"Colin Cairnes, Cameron Cairnes","Derek Dauchy, Mat Govoni, Steven Schneider, Roy Lee, Adam White, John Molloy","Colin Cairnes, Cameron Cairnes",IFC Films,"AGC Studios, Shudder, Good Fiend Films, IFC Films, Spooky Pictures, Future Pictures, Image Nation, VicScreen",R (Language|A Sexual Reference|Some Gore|Violent Content),"Horror, Mystery & Thriller",English,"Mar 22, 2024, Wide",19-Apr-24,$10.0M,1h 33m,,,"Colin Cairnes, Cameron Cairnes, David Dastmalchian, Laura Gordon, Fayssal Bazzi, Ian Bliss"
Nights of Cabiria,100%,94%,Federico Fellini,Dino De Laurentiis,"Federico Fellini, Ennio Flaiano, Tullio Pinelli",Paramount Pictures,"Dino de Laurentiis Corp., Les Films Marceau",,Drama,Italian,"Dec 31, 1957, Original",1-May-08,$823.6K,1h 50m,Mono,Flat (1.37:1),"Federico Fellini, Giulietta Masina, François Perier, Amedeo Nazzari, Franca Marzi, Dorian Gray"
What's Love Got to Do With It,97%,88%,Brian Gibson,"Doug Chapin, Barry Krost","Tina Turner, Kurt Loder, Kate Lanier","Abril Vídeo, Buena Vista Pictures",Touchstone Pictures,R,Biography,English,"Jun 9, 1993, Wide",1-Jan-14,$38.9M,1h 58m,Surround,,"Brian Gibson, Angela Bassett, Laurence Fishburne, Vanessa Bell Calloway, Jenifer Lewis, RaéVen Larrymore Kelly"
Ordinary Angels,84%,99%,Jon Gunn,"David Beal, Jon Berg, Johnathan Dorfman, Kevin Downes, Andrew Erwin, Jon Erwin, Sarah E. Johnson, Dave Matthews","Kelly Fremon Craig, Meg Tilly",Lionsgate,"Vertigo Entertainment, Kingdom Story Company, Stampede Ventures",PG (Smoking|Brief Bloody Images|Thematic Content),Drama,English,"Feb 23, 2024, Wide",26-Mar-24,$19.1M,1h 56m,,,"Jon Gunn, Hilary Swank, Alan Ritchson, Nancy Travis, Amy Acker, Tamala Jones"
Scrooged,71%,71%,Richard Donner,"Richard Donner, Art Linson","Mitch Glazer, Michael O'Donoghue",Paramount Pictures,Paramount Pictures,PG-13,"Holiday, Comedy, Fantasy",English,"Nov 23, 1988, Original",6-Jun-14,$58.2M,1h 41m,"Surround, Dolby Stereo",Flat (1.85:1),"Richard Donner, Bill Murray, Karen Allen, John Forsythe, John Glover, Bobcat Goldthwait"
Shaolin Soccer,89%,84%,"Stephen Chow, Lee Lik-Chi",Kwok-fai Yeung,"Stephen Chow, Kan-Cheung Tsang, Lee Lik-Chi, Min Hun Fung",,"Star Overseas, Miramax, Universe Entertainment",,"Comedy, Action",Chinese,,23-May-16,$488.9K,1h 51m,Surround,,"Stephen Chow, Lee Lik-Chi, Stephen Chow, Wei Zhao, Yin Tse, Cecilia Cheung"
The Dark Knight,94%,94%,Christopher Nolan,"Emma Thomas, Charles Roven, Christopher Nolan","Jonathan Nolan, Christopher Nolan",Warner Bros. Pictures,"Syncopy, Legendary Entertainment, Warner Bros.",PG-13 (Some Menace|Intense Sequences of Violence),"Action, Adventure, Fantasy",English,"Jul 18, 2008, Wide",14-Jun-10,$2.0M,2h 32m,"DTS, Dolby Digital, SDDS",Scope (2.35:1),"Christopher Nolan, Christian Bale, Heath Ledger, Aaron Eckhart, Michael Caine, Maggie Gyllenhaal"
Those Who Walk Away,33%,93%,Robert Rippberger,"KT Kent, Robert Rippberger","Robert Rippberger, Spencer Moleda",VMI Worldwide,"Sandeep Sekhar Films, SIE Films, Slated, Argentic Productions",,"Horror, Mystery & Thriller",English,"Feb 11, 2022, Limited",11-Feb-22,,1h 34m,,,"Robert Rippberger, Booboo Stewart, Scarlett Sperduto, Nils Allen Stewart, Bryson JonSteele, Josh Bradshaw"
Citizen Kane,99%,90%,Orson Welles,Orson Welles,"Herman J. Mankiewicz, Orson Welles, John Houseman",RKO Radio Pictures,"Mercury Productions, RKO Radio Pictures Inc.",PG,Drama,English,"May 1, 1941, Wide",28-Jun-16,$977.3K,1h 59m,Mono,Academy (1.33:1),"Orson Welles, Orson Welles, Joseph Cotten, Ruth Warrick, Everett Sloane, Agnes Moorehead"
Star Trek,94%,91%,J.J. Abrams,"J.J. Abrams, Damon Lindelof","Roberto Orci, Alex Kurtzman",Paramount Pictures,"Bad Robot, Spyglass Entertainment, Paramount Pictures",PG-13 (Sci-Fi Action|Brief Sexual Content|Violence),"Sci-Fi, Adventure, Action, Fantasy",English,"May 7, 2009, Wide",1-Aug-13,$257.7M,2h 6m,,,"J.J. Abrams, Chris Pine, Zachary Quinto, Leonard Nimoy, Eric Bana, Bruce Greenwood"
Top Hat,100%,90%,Mark Sandrich,Pandro S. Berman,"Aladar Laszlo, Károly Nóti, Allan Scott, Dwight Taylor",RKO Radio Pictures,RKO Radio Pictures Inc.,,"Musical, Romance",English,"Sep 6, 1935, Wide",18-Aug-08,,1h 39m,Mono,Flat (1.37:1),"Mark Sandrich, Fred Astaire, Ginger Rogers, Edward Everett Horton, Helen Broderick, Eric Blore"
