Triangle of Sadness,71%,80%,Ruben Östlund,"Philippe Bober, Erik Hemmendorff",Ruben Östlund,NEON,"Essential Films, TRT Sinema, Film i Väst, Coproduction Office, ZDF Arte, Plattform Produktion, Sveriges Television, Imperative Entertainment, BBC Film, arte France Cinéma, 30West",R (Some Sexual Content|Language),Comedy,English,"Oct 7, 2022, Limited",22-Nov-22,$4.6M,2h 29m,Dolby Atmos,,"Ruben Östlund, Harris Dickinson, Charlbi Dean Kriek, Woody Harrelson, Dolly De Leon, Zlatko Buric"
The Northman,90%,64%,Robert Eggers,"Robert Eggers, Mark Huffam, Lars Knudsen, Arnon Milchan, Alexander Skarsgård","Sjón, Robert Eggers",Focus Features,"Square Peg, New Regency, Perfect World Pictures, Focus Features, Universal Pictures",R (Some Sexual Content|Nudity|Strong Bloody Violence),"Adventure, Action, Mystery & Thriller",English,"Apr 22, 2022, Wide",13-May-22,$34.2M,2h 17m,"Dolby Digital, Dolby Atmos",,"Robert Eggers, Alexander Skarsgård, Nicole Kidman, Claes Bang, Ethan Hawke, Anya Taylor-Joy"
Lift,30%,33%,F. Gary Gray,"Audrey Chon, Kevin Hart, Adam Kassan, Simon Kinberg, Matt Reeves, Bryan Smiley","Jeremy Doner, Daniel Kunka",Netflix,"6th & Idaho Productions, HartBeat Productions, Genre Pictures",PG-13 (Violence and Action|Suggestive Material|Some Language),"Action, Comedy, Crime, Drama",English,"Jan 12, 2024, Limited",12-Jan-24,,1h 44m,Dolby Digital,,"F. Gary Gray, Kevin Hart, Gugu Mbatha-Raw, Vincent D'Onofrio, Úrsula Corberó, Billy Magnussen"
Senna,93%,95%,Asif Kapadia,"Tim Bevan, Chris Berend, James Gay-Rees, Eric Fellner",Manish Pandey,PDA,"Universal Pictures, Working Title Films, StudioCanal",PG-13 (Some Strong Language|Disturbing Images),Documentary,English,"Aug 12, 2011, Limited",10-Aug-16,$1.6M,1h 44m,,,"Asif Kapadia, Alain Prost, Sir Frank Williams, Ron Dennis, Viviane Senna, Jackie Stewart"
In the Cut,34%,34%,Jane Campion,"Laurie Parker, Nicole Kidman","Jane Campion, Susanna Moore, Susanna Moore",Screen Gems,"Pathé Pictures, Red Turtle, Pathé Productions Inc.",R (Graphic Crime Scenes|Explicit Dialogue|Language|Nudity|Strong Sexuality),"Mystery & Thriller, Drama",English,"Oct 24, 2003, Wide",1-Apr-10,$4.7M,1h 58m,Surround,,"Jane Campion, Meg Ryan, Mark Ruffalo, Jennifer Jason Leigh, Nick Damici, Sharrieff Pugh"
Gerald's Game,91%,70%,Mike Flanagan,Trevor Macy,"Jeff Howard, Mike Flanagan",,Intrepid Pictures,TV-MA,"Horror, Mystery & Thriller",English,,29-Sep-17,,1h 43m,,,"Mike Flanagan, Carla Gugino, Bruce Greenwood, Henry Thomas, Carel Struycken, Kate Siegel"
The Hunger,58%,66%,Tony Scott,Richard Shepherd,"James Costigan, Ivan Davis, Whitley Strieber, Michael Thomas","MGM/UA Home Entertainment Inc., Metro-Goldwyn-Mayer","Metro Goldwyn Mayer, Peerford Ltd.",R,Horror,English,"Apr 29, 1983, Original",14-Oct-14,,1h 37m,Mono,Scope (2.35:1),"Tony Scott, Catherine Deneuve, David Bowie, Susan Sarandon, Cliff DeYoung, Beth Ehlers"
DarkGame,,30%,Howard J. Ford,Tom George,"Gary Grant, Niall Johnson",Gravitas Ventures,"Happy Hour Films, Principal Film Finance, JCG Bits Productions",,"Horror, Mystery & Thriller",British English,,20-Feb-24,,1h 41m,,,"Howard J. Ford, Ed Westwick, Andrew P. Stephen, Natalya Tsvetkova, Lola Wayne, Rose Reynolds"
Spellbound,46%,51%,Vicky Jenson,"John Lasseter, David Ellison, Dana Goldberg, Bruce Anderson, Linda Woolverton","Vicky Jenson, Lauren Hynek, Elizabeth Martin, Lauren Hynek, Elizabeth Martin, Julia Miranda",Netflix,Skydance Animation,PG,"Adventure, Fantasy, Animation, Comedy, Kids & Family",English,"Nov 22, 2024, Limited",22-Nov-24,,1h 50m,,,"Vicky Jenson, Rachel Zegler, Miguel Bernardeau, Jenifer Lewis, Dee Bradley Baker, Nicole Kidman"
Anora,95%,90%,Sean Baker,"Alex Coco, Samantha Quan, Sean Baker",Sean Baker,NEON,Cre Film,R (Graphic Nudity|Drug Use|Pervasive Language|Strong Sexual Content),"Comedy, Drama, Romance",English,"Nov 8, 2024, Wide",17-Dec-24,$13.8M,2h 19m,Dolby Digital,Digital 2.39:1,"Sean Baker, Mikey Madison, Mark Eydelshteyn, Yura Borisov, Karren Karagulian, Vache Tovmasyan"
Mr. Jimmy,100%,100%,Peter Michael Dowd,Peter Michael Dowd,,Abramorama,,,"Documentary, Music, Biography",English,"Sep 1, 2023, Limited",25-Dec-24,,1h 52m,,,"Peter Michael Dowd, Jimmy Page, Jason Bonham, Frankie Banali, Rie Nakahara, Peter Michael Dowd"
Best. Christmas. Ever!,40%,19%,Mary Lambert,Charles Shyer,"Todd Calgi Gallicano, Charles Shyer",Netflix,Motion Picture Corporation of America (MPCA),,"Holiday, Romance, Comedy",English,"Nov 16, 2023, Limited",16-Nov-23,,1h 20m,,,"Mary Lambert, Heather Graham, Jason Biggs, Brandy Norwood, Matt Cedeno, Wyatt Hunt"
Bull Durham,97%,82%,Ron Shelton,"Thom Mount, Mark Burg",Ron Shelton,Orion Pictures,The Mount Company,R,"Romance, Comedy",English,"Jun 15, 1988, Original",2-Sep-14,$49.9M,1h 48m,Surround,,"Ron Shelton, Kevin Costner, Susan Sarandon, Tim Robbins, Trey Wilson, Robert Wuhl"
Terrifier 2,86%,81%,Damien Leone,"Steven Della Salla, Phil Falcone, Jason Leavy, Michael Leavy",Damien Leone,Cinedigm,"Dark Age Cinema, Fuzz on the Lens Productions",,"Holiday, Horror, Mystery & Thriller",English,"Oct 6, 2022, Wide",,$10.4M,2h 18m,,,"Damien Leone, Lauren LaVera, David Howard Thornton, Elliott Fullam, Sarah Voigt, Felissa Rose"
The Hustler,94%,92%,Robert Rossen,Robert Rossen,"Sidney Carroll, Robert Rossen, Walter Tevis","20th Century Fox, Key Video",Rossen Films,,Drama,English,"Sep 25, 1961, Wide",25-Nov-15,,2h 15m,Mono,Scope (2.35:1),"Robert Rossen, Paul Newman, Jackie Gleason, George C. Scott, Piper Laurie, Myron McCormick"
North by Northwest,97%,94%,Alfred Hitchcock,Alfred Hitchcock,Ernest Lehman,Metro-Goldwyn-Mayer,Metro Goldwyn Mayer,,Mystery & Thriller,English,"Jul 17, 1959, Wide",17-Nov-09,,2h 16m,Mono,Flat (1.66:1),"Alfred Hitchcock, Cary Grant, Eva Marie Saint, James Mason, Leo G. Carroll, Martin Landau"
Fire in Babylon,91%,86%,Stevan Riley,"John Battsek, Charles Steel",Stevan Riley,,"ECN Motion Pictures, Cowboy Films, Passion Pictures, Hargitay & Hargitay Pictures in Motion, E & G Productions",,Documentary,British English,,16-Apr-12,,1h 23m,,,"Stevan Riley, Colin Croft, Joel Garner, Tony Greig, Desmond Haynes, Jason Holder"
The Way Back,85%,84%,Gavin O'Connor,"Gordon Gray, Jennifer Todd, Gavin O'Connor, Ravi Mehta",Brad Ingelsby,Warner Bros. Pictures,"BRON Studios, Mayhem Pictures, Creative Wealth Media Finance",R (Some Sexual References|Language Throughout),Drama,English,"Mar 6, 2020, Wide",6-Mar-20,,1h 48m,Dolby Atmos,Scope (2.35:1),"Gavin O'Connor, Ben Affleck, Al Madrigal, Janina Gavankar, Jeremy Radin, Brandon Wilson"
Casino Royale,94%,90%,Martin Campbell,"Barbara Broccoli, Michael G. Wilson","Neal Purvis, Robert Wade, Anthony Waye, Ian Fleming",Sony Pictures Entertainment,"Eon Productions Ltd., Sony Pictures Entertainment, Metro-Goldwyn-Mayer",PG-13 (Nudity|A Scene of Torture|Sequences of Violent Action|Sexual Content),"Action, Adventure, Mystery & Thriller",English,"Nov 17, 2006, Wide",30-Nov-16,$167.0M,2h 24m,"Dolby SRD, DTS, SDDS",Scope (2.35:1),"Martin Campbell, Daniel Craig, Eva Green, Mads Mikkelsen, Judi Dench, Caterina Murino"
The Conformist,98%,90%,Bernardo Bertolucci,Maurizio Lodi-Fè,"Bernardo Bertolucci, Alberto Moravia",Paramount Pictures,"Mars Film, Maran Film, Marianne Productions",R,Drama,Italian,"Oct 22, 1970, Original",24-Oct-14,$179.7K,1h 51m,Mono,Flat (1.85:1),"Bernardo Bertolucci, Jean-Louis Trintignant, Stefania Sandrelli, Dominique Sanda, Pierre Clémenti, Gastone Moschin"
Hidden Figures,93%,93%,Theodore Melfi,"Donna Gigliotti, Peter Chernin, Jenno Topping, Pharrell Williams, Theodore Melfi","Allison Schroeder, Theodore Melfi",20th Century Fox,"Chernin Entertainment, Fox 2000 Pictures, Levantine Films",PG (Thematic Elements|Some Language),"History, Drama",English,"Jan 6, 2017, Wide",28-Mar-17,$169.3M,2h 7m,Dolby Digital,,"Theodore Melfi, Taraji P. Henson, Octavia Spencer, Janelle Monáe, Kevin Costner, Mahershala Ali"
Texas Chainsaw Massacre,30%,25%,David Blue Garcia,"Fede Alvarez, Kim Henkel, Ian Henkel, Pat Cassidy, Herb Gains",Chris Thomas Devlin,,"Legendary Pictures, Exurbia Films, Bad Hombre",R (Strong Bloody Horror Violence|Language|Gore),"Horror, Mystery & Thriller",English,,18-Feb-22,,1h 23m,Dolby Digital,,"David Blue Garcia, Sarah Yarkin, Elsie Fisher, Mark Burnham, Jacob Latimore, Moe Dunford"
Amber Alert,63%,63%,Kerry Bellessa,"Joseph Restaino, Summer Bellessa, Tony Stopperan, Kerry Bellessa, Leal Naim","Kerry Bellessa, Joshua Oram",Lionsgate,"Hungry Bull Productions, Three Point Capital (TPC), Bluefields Entertainment",PG-13 (Violent Content|Disturbing Images|Thematic Material|Language),Mystery & Thriller,English,"Sep 27, 2024, Limited",27-Sep-24,,1h 30m,,,"Kerry Bellessa, Hayden Panettiere, Tyler James Williams, Kevin Dunn, Saidah Arrika Ekulona, Katie McClellan"
Down to Earth,19%,40%,"Chris Weitz, Paul Weitz","Sean Daniel, Michael Rotenberg, James Jacks","Chris Rock, Lance Crouther, Ali LeRoi, Louis C.K.",Paramount Pictures,"Paramount Pictures, NPV Entertainment, Village Roadshow Prod.",PG-13 (Sexual Humor|Language|Drug References),Comedy,English,"Feb 16, 2001, Wide",21-Jan-10,$64.2M,1h 27m,"Dolby SR, DTS, Dolby Stereo, Surround, Dolby A, Dolby Digital",Flat (1.85:1),"Chris Weitz, Paul Weitz, Chris Rock, Regina King, Chazz Palminteri, Eugene Levy"
House of Wax,93%,73%,Andre de Toth,Bryan Foy,"Charles Belden, Crane Wilbur","Warner Home Vídeo, Warner Bros.",Warner Brothers,PG,Horror,English,"Apr 10, 1953, Original",19-Apr-16,,1h 28m,"Stereo, Mono",,"Andre de Toth, Vincent Price, Frank Lovejoy, Phyllis Kirk, Carolyn Jones, Paul Picerni"
The Muppet Christmas Carol,77%,86%,Brian Henson,"Brian Henson, Martin G. Baker",Jerry Juhl,Buena Vista Pictures,"Walt Disney Pictures, Jim Henson Productions",G,"Kids & Family, Holiday, Fantasy",English,"Dec 11, 1992, Wide",30-Nov-16,$27.4M,1h 25m,"Surround, Stereo, Dolby",Flat (1.85:1),"Brian Henson, Michael Caine, Dave Goelz, Steve Whitmire, Jerry Nelson, David Rudman"
Breath,80%,74%,Simon Baker,"Simon Baker, Jamie Hilton, Mark Johnson","Gerard Lee, Simon Baker, Tim Winton",FilmRise,"FilmRise, Gran Via Productions, See Pictures, Screen Australia, Embankment Films",,Drama,Australian English,"Jun 1, 2018, Limited",5-Sep-18,$34.1K,1h 55m,,,"Simon Baker, Simon Baker, Samson Coulter, Ben Spence, Elizabeth Debicki, Richard Roxburgh"
The Lord of the Rings: The Fellowship of the Ring,92%,95%,Peter Jackson,"Peter Jackson, Barrie M. Osborne, Fran Walsh, Tim Sanders","Peter Jackson, Fran Walsh, Philippa Boyens, J.R.R. Tolkien",New Line Cinema,"New Line Cinema, WingNut Films, Saul Zaentz Company",PG-13 (Some Scary Images|Epic Battle Sequences),"Fantasy, Adventure",English,"Dec 13, 2001, Wide",28-Jun-11,$315.5M,2h 58m,"Dolby SR, DTS, Dolby Stereo, Surround, SDDS, Dolby A, Dolby EX, Dolby Digital",Scope (2.35:1),"Peter Jackson, Elijah Wood, Ian McKellen, Liv Tyler, Viggo Mortensen, Sean Astin"
Kill,89%,85%,Nikhil Nagesh Bhat,"Karan Johar, Apoorva Mehta, Guneet Monga, Achin Jain",Nikhil Nagesh Bhat,Roadside Attractions / Lionsgate,Sikhya Entertainment,R,"Action, Mystery & Thriller",Hindi,"Jul 4, 2024, Limited",23-Jul-24,$1.2M,1h 46m,"Dolby Atmos, Dolby Digital",Digital 2.39:1,"Nikhil Nagesh Bhat, Laksh Lalwani, Tanya Maniktala, Raghav Juyal, Abhishek Chauhan, Rupesh Kumar Charanpahari"
Whitney Houston: I Wanna Dance with Somebody,43%,92%,Kasi Lemmons,"Anthony McCarten, Patricia Houston, Clive Davis, Larry Mestel, Denis O'Sullivan, Jeff Kalligheri, Matt Jackson, Molly Smith, Trent Luckinbill, Thad Luckinbill, Matthew Salloway, Christina Papagjika",Anthony McCarten,TriStar Pictures,"West Madison Entertainment, Primary Wave Entertainment, Compelling Pictures, Muse of Fire, Black Label Media, TriStar Pictures",PG-13 (Some Strong Language|Smoking|Strong Drug Content|Suggestive References),"Biography, Drama, Music",English,"Dec 23, 2022, Wide",28-Feb-23,$23.4M,2h 26m,Dolby Digital,Scope (2.35:1),"Kasi Lemmons, Naomi Ackie, Stanley Tucci, Nafessa Williams, Tamara Tunie, Clarke Peters"
"Sex, Lies, and Videotape",96%,79%,Steven Soderbergh,"Bobby Newmyer, John Hardy",Steven Soderbergh,"Miramax Films, Criterion Collection",Outlaw Productions,R,Drama,English,"Aug 4, 1989, Original",18-Dec-15,$22.7M,1h 41m,Surround,,"Steven Soderbergh, James Spader, Andie MacDowell, Peter Gallagher, Laura San Giacomo, Ron Vawter"
The Prestige,77%,92%,Christopher Nolan,"Christopher Nolan, Aaron Ryder, Emma Thomas","Jonathan Nolan, Christopher Nolan",Buena Vista,Newmarket Productions,PG-13 (Violence|Disturbing Images),"Drama, Fantasy, Mystery & Thriller",English,"Oct 20, 2006, Wide",23-Nov-15,$53.1M,2h 10m,"Dolby SRD, DTS, SDDS",Scope (2.35:1),"Christopher Nolan, Hugh Jackman, Christian Bale, Michael Caine, Scarlett Johansson, Piper Perabo"
The Treasure of the Sierra Madre,100%,93%,John Huston,Henry Blanke,"B. Traven, John Huston","Warner Bros. Pictures, MGM/UA Home Entertainment Inc.",Warner Brothers,,"Adventure, Western, Drama",English,"Jan 6, 1948, Original",8-May-15,,2h 4m,,,"John Huston, Humphrey Bogart, Walter Huston, Tim Holt, Bruce Bennett, Barton MacLane"
Victory,70%,71%,John Huston,Freddie Fields,"Evan Jones, Yabo Yablonsky",Paramount Pictures,Lorimar Film Entertainment,PG,Action,English,"Jul 16, 1981, Wide",1-Jan-09,,1h 57m,Surround,,"John Huston, Sylvester Stallone, Michael Caine, Pelé, Bobby Moore, Osvaldo Ardiles"
Blonde,42%,36%,Andrew Dominik,"Dede Gardner, Jeremy Kleiner, Tracey Landon, Brad Pitt, Scott Robertson",Andrew Dominik,Netflix,Plan B Entertainment,NC-17 (Some Sexual Content),"Biography, Drama",English,"Sep 16, 2022, Limited",28-Sep-22,,2h 46m,,,"Andrew Dominik, Ana de Armas, Adrien Brody, Bobby Cannavale, Evan Williams, Xavier Samuel"
Henry & June,60%,68%,Philip Kaufman,Peter Kaufman,"Philip Kaufman, Rose Kaufman",Universal Pictures,"Walrus & Associates, Ministère de la Culture de la Republique Française, Universal Pictures",NC-17,Drama,English,"Oct 5, 1990, Wide",,$11.0M,2h 16m,"Dolby, Surround",,"Philip Kaufman, Fred Ward, Uma Thurman, Maria de Medeiros, Richard E. Grant, Kevin Spacey"
Call Me by Your Name,95%,86%,Luca Guadagnino,"Peter Spears, Luca Guadagnino, Emilie Georges, Rodrigo Teixeira, Marco Morabito","James Ivory, Luca Guadagnino, Walter Fasano",Sony Pictures Classics,"RT Features, La Cinéfacture, Frenesy Film",R (Sexual Content|Nudity|Some Language),"Romance, Drama, LGBTQ+",English,"Jan 19, 2018, Wide",23-Feb-18,$18.0M,2h 12m,Dolby Digital,Flat (1.85:1),"Luca Guadagnino, Armie Hammer, Timothée Chalamet, Michael Stuhlbarg, Amira Casar, Esther Garrel"
The Boxer,81%,74%,Jim Sheridan,"Arthur Lappin, Jim Sheridan","Jim Sheridan, Terry George",Universal Pictures,"Universal Pictures, Hell's Kitchen Films",R (Some Violence|Language),Drama,English,"Dec 19, 1997, Wide",5-Mar-16,$5.8M,1h 53m,"SDDS, DTS, Surround",35mm,"Jim Sheridan, Daniel Day-Lewis, Emily Watson, Brian Cox, Ken Stott, Gerard McSorley"
Finestkind,28%,61%,Brian Helgeland,"David Glasser, Taylor Sheridan, Gary Foster, Brian Helgeland, Russ Krasnoff",Brian Helgeland,Paramount+,"MTV Entertainment Studios, 101 Studios, Krasnoff/Foster Entertainment, Bosque Ranch Productions",R (Sexual Content|Pervasive Language|Drug Material|Some Violence),"Crime, Drama, Mystery & Thriller",English,,15-Dec-23,,2h 6m,Dolby Digital,,"Brian Helgeland, Jenna Ortega, Tommy Lee Jones, Ben Foster, Ismael Cruz Cordova, Clayne Crawford"
Sonic the Hedgehog,64%,93%,Jeff Fowler,"Neal H. Moritz, Toby Ascher, Toru Nakahara, Takeshi Ito","Pat Casey, Josh Miller",Paramount Pictures,"Original Film, Paramount Pictures",PG (Brief Mild Language|Action|Rude Humor|Some Violence),"Kids & Family, Comedy, Adventure",English,"Feb 14, 2020, Wide",31-Mar-20,$146.7M,1h 40m,"Dolby Atmos, Dolby Digital",Digital 2.39:1,"Jeff Fowler, James Marsden, Jim Carrey, Ben Schwartz, Tika Sumpter, Natasha Rothwell"
Before Midnight,98%,82%,Richard Linklater,"Richard Linklater, Christos V. Konstantakopoulos, Sara Woodhatch","Richard Linklater, Julie Delpy, Ethan Hawke",Sony Pictures Classics,"Faliro House, Castle Rock Entertainment, Venture Forth",R (Sexual Content/Nudity|Language),"Romance, Drama",English,"May 24, 2013, Limited",15-Oct-13,$8.1M,1h 49m,,,"Richard Linklater, Ethan Hawke, Julie Delpy, Seamus Davey-Fitzpatrick, Jennifer Prior, Charlotte Prior"
Last Christmas,46%,81%,Paul Feig,"Erik Baiers, Jessie Henderson, David Livingstone, Emma Thompson","Emma Thompson, Bryony Kimmings",Universal Pictures,"Universal Pictures, Feigco Entertainment",PG-13 (Language and Sexual Content),"Holiday, Romance, Comedy",English,"Nov 8, 2019, Wide",8-Nov-19,$35.1M,1h 42m,,,"Paul Feig, Emilia Clarke, Henry Golding, Michelle Yeoh, Emma Thompson, Rebecca Root"
Spy,95%,78%,Paul Feig,"Peter Chernin, Jenno Topping, Paul Feig, Jessie Henderson",Paul Feig,20th Century Fox,"Greenery Studios, Chernin Entertainment, Twentieth Century Fox, Feigco Entertainment",R (Language Throughout|Brief Graphic Nudity|Some Sexual Content|Violence),"Comedy, Action",English,"Jun 5, 2015, Wide",4-Sep-15,,1h 55m,Dolby Atmos,,"Paul Feig, Melissa McCarthy, Jason Statham, Rose Byrne, Miranda Hart, Bobby Cannavale"
The First Omen,83%,70%,Arkasha Stevenson,"David S. Goyer, Keith Levine","Tim Smith, Arkasha Stevenson, Keith Thomas",20th Century Studios,"Serbia Film Commission, Cattleya, 20th Century Studios, TSG Entertainment, Kiwii, Phantom Four Films, The Government of Canada Income Tax Credit Program",R (Grisly/Disturbing Images|Brief Graphic Nudity|Violent Content),"Horror, Mystery & Thriller",English,"Apr 5, 2024, Wide",28-May-24,$20.1M,1h 59m,,Flat (1.85:1),"Arkasha Stevenson, Nell Tiger Free, Ralph Ineson, Sonia Braga, Tawfeek Barhom, María Caballero"
Saltburn,71%,79%,Emerald Fennell,"Emerald Fennell, Josey McNamara, Margot Robbie",Emerald Fennell,MGM,"Lie Still, Metro-Goldwyn-Mayer, LuckyChap Entertainment, MRC",R (Drug Use|Disturbing Violent Content|Graphic Nudity|Language Throughout|Strong Sexual Content),"Comedy, Drama, Mystery & Thriller",English,"Nov 22, 2023, Wide",22-Dec-23,$11.4M,2h 11m,Dolby Digital,,"Emerald Fennell, Barry Keoghan, Jacob Elordi, Rosamund Pike, Richard E. Grant, Alison Oliver"
Don't Look Up,56%,78%,Adam McKay,"Adam McKay, Kevin J. Messick","Adam McKay, David Sirota",Netflix,Hyperobject Industries,R (Graphic Nudity|Drug Content|Language Throughout|Some Sexual Content),Comedy,English,"Dec 10, 2021, Limited",24-Dec-21,,2h 18m,"Dolby Atmos, Dolby Digital",Scope (2.35:1),"Adam McKay, Leonardo DiCaprio, Jennifer Lawrence, Meryl Streep, Rob Morgan, Jonah Hill"
Black Christmas,71%,76%,Bob Clark,Bob Clark,Roy Moore,"Eclectic DVD Distribution, Warner Home Vídeo, Warner Bros.","Film Funding Ltd. of Canada, August Films, Famous Players, Canadian Film Development Corporation (CFDC), Vision IV",R,"Holiday, Horror",English,"Dec 20, 1974, Wide",13-Dec-16,,1h 38m,Mono,Flat (1.85:1),"Bob Clark, Olivia Hussey, Margot Kidder, Keir Dullea, John Saxon, Marian Waldman"
Knives Out,97%,92%,Rian Johnson,"Rian Johnson, Ram Bergman, Jonathan Golfman, Brye Adler",Rian Johnson,Lionsgate Films,"FilmNation Entertainment, Media Rights Capital",PG-13 (Drug Material|Brief Violence|Sexual References|Some Strong Language|Thematic Elements),"Mystery & Thriller, Comedy, Drama",English,"Nov 27, 2019, Wide",12-Jun-20,$165.4M,2h 10m,"Dolby Atmos, Dolby Digital",Flat (1.85:1),"Rian Johnson, Daniel Craig, Chris Evans, Ana de Armas, Jamie Lee Curtis, Toni Collette"
Mosquito State,61%,43%,Filip Jan Rymsza,"Filip Jan Rymsza, Włodzimierz Niderhaus, Alyssa Swanzey","Filip Jan Rymsza, Mario Zermeno, Filip Jan Rymsza, Mario Zermeno",,Royal Road Entertainment,,"Drama, Horror, Mystery & Thriller",English,,26-Aug-21,,1h 40m,,,"Filip Jan Rymsza, Beau Knapp, Charlotte Vega, Jack Kesy, Olivier Martinez, Audrey Wasilewski"
Pinocchio,27%,27%,Robert Zemeckis,"Robert Zemeckis, Derek Hogue, Andrew Miano, Chris Weitz, Paul Weitz","Robert Zemeckis, Chris Weitz",,"Depth of Field, ImageMovers",PG (Some Language|Rude Material|Peril/Scary Moments),"Kids & Family, Fantasy, Adventure, Comedy, Drama",English,,8-Sep-22,,1h 51m,"Dolby Atmos, Dolby Digital",Flat (1.85:1),"Robert Zemeckis, Tom Hanks, Benjamin Evan Ainsworth, Cynthia Erivo, Joseph Gordon-Levitt, Keegan-Michael Key"
Pather Panchali,98%,93%,Satyajit Ray,,Satyajit Ray,,Government of West Bengal,,Drama,Bangla,,20-Oct-15,,2h 6m,,,"Satyajit Ray, Kanu Bannerjee, Karuna Bannerjee, Subir Bannerjee, Uma Das Gupta, Chunibala Devi"
Bringing Up Baby,97%,89%,Howard Hawks,Howard Hawks,"Hagar Wilde, Dudley Nichols, Hagar Wilde",RKO Radio Pictures,RKO Radio Pictures Inc.,,Comedy,English,"Feb 18, 1938, Wide",1-Jan-08,,1h 42m,Mono,,"Howard Hawks, Katharine Hepburn, Cary Grant, Charlie Ruggles, May Robson, Barry Fitzgerald"
Interstellar,72%,87%,Christopher Nolan,"Emma Thomas, Christopher Nolan, Lynda Obst","Jonathan Nolan, Christopher Nolan",Paramount Pictures,"Syncopy, Lynda Obst Productions",PG-13 (Some Intense Perilous Action|Brief Strong Language),"Sci-Fi, Adventure, Action",English,"Nov 7, 2014, Wide",24-May-16,$188.0M,2h 45m,"Datasat, Dolby Digital",,"Christopher Nolan, Matthew McConaughey, Anne Hathaway, Jessica Chastain, Michael Caine, Bill Irwin"
The Santa Clause,73%,66%,John Pasquin,"Bobby Newmyer, Brian Reilly, Jeffrey Silver","Leo Benvenuti, Steve Rudnick","Hollywood Pictures, Buena Vista Pictures, Buena Vista International [us], Walt Disney Pictures","Walt Disney Pictures, Outlaw Productions, Hollywood Pictures",PG,"Kids & Family, Holiday, Comedy",English,"Nov 11, 1994, Wide",1-Jan-14,$145.5M,1h 37m,"Surround, Stereo, Dolby Digital",,"John Pasquin, Tim Allen, Judge Reinhold, Wendy Crewson, Eric Lloyd, David Krumholtz"
12 Years a Slave,95%,90%,Steve McQueen,"Brad Pitt, Dede Gardner, Jeremy Kleiner, Bill Pohlad, Steve McQueen, Arnon Milchan, Anthony Katagas",John Ridley,Fox Searchlight,"River Road, New Regency Pictures, Plan B Entertainment",R (Some Nudity|Brief Sexuality|Violence/Cruelty),"History, Drama, Biography",English,"Oct 18, 2013, Limited",31-Aug-15,$56.7M,2h 14m,"Datasat, Dolby Digital",,"Steve McQueen, Chiwetel Ejiofor, Michael Fassbender, Benedict Cumberbatch, Paul Dano, Garret Dillahunt"
Magic Mike,78%,60%,Steven Soderbergh,"Nick Wechsler, Gregory Jacobs, Channing Tatum, Reid Carolin",Reid Carolin,Warner Bros. Pictures,"Extension 765, Iron Horse Entertainment",R (Language|Brief Graphic Nudity|Pervasive Sexual Content|Some Drug Use),"Comedy, Drama",English,"Jun 29, 2012, Wide",7-Jan-14,$113.7M,1h 50m,,,"Steven Soderbergh, Channing Tatum, Alex Pettyfer, Matthew McConaughey, Cody Horn, Olivia Munn"
Single All the Way,70%,67%,Michael Mayer,Joel S. Rice,Chad Hodge,,Muse Entertainment Enterprises,,"Holiday, Romance, Comedy, LGBTQ+",English,,2-Dec-21,,1h 39m,,,"Michael Mayer, Michael Urie, Philemon Chambers, Kathy Najimy, Luke Macfarlane, Barry Bostwick"
A League of Their Own,82%,84%,Penny Marshall,"Robert Greenhut, Elliot Abbott","Kelly Candaele, Lowell Ganz, Babaloo Mandel",Columbia Pictures,"Parkway Productions, Columbia Pictures Corporation",PG,"Comedy, Drama",English,"Jul 1, 1992, Original",16-Apr-12,$105.1M,2h 6m,Surround,Scope (2.35:1),"Penny Marshall, Tom Hanks, Geena Davis, Madonna, Lori Petty, Jon Lovitz"
Beyond the Mat,82%,83%,Barry W. Blaustein,"Barry W. Blaustein, Barry Bloom, Brian Grazer, Ron Howard, Michael Rosenberg",Barry W. Blaustein,"Image Entertainment Inc., Universal Pictures, Lionsgate Films","Imagine Entertainment, Lions Gate Entertainment",R (Violent Content|Language),Documentary,English,"Mar 17, 2000, Wide",10-Aug-16,$2.0M,1h 42m,"Surround, Dolby Digital",Flat (1.85:1),"Barry W. Blaustein, Terry Funk, Mick Foley, Jake ""The Snake"" Roberts, Vince McMahon, Roland Alexander"
Die Hard With a Vengeance,60%,83%,John McTiernan,"Michael Tadross, John McTiernan","Roderick Thorp, Jonathan Hensleigh","Fox, 20th Century Fox","20th Century Fox, Cinergi Pictures Entertainment",R,"Action, Adventure, Mystery & Thriller",English,"May 19, 1995, Original",1-Mar-13,$99.5M,2h 8m,"Surround, Stereo",,"John McTiernan, Bruce Willis, Jeremy Irons, Samuel L. Jackson, Graham Greene, Colleen Camp"
Cobb,65%,58%,Ron Shelton,David V. Lester,,,"Alcor Films, Warner Bros., Regency Enterprises",R,Biography,English,,21-Nov-16,$648.1K,2h 8m,"Stereo, Surround",,"Ron Shelton, Tommy Lee Jones, Robert Wuhl, Lolita Davidovich, Lou Myers, Stephen Mendillo"
The Adventures of Robin Hood,100%,89%,"Michael Curtiz, William Keighley",Hal B. Wallis,"Norman Reilly Raine, Seton I. Miller",Warner Bros. Pictures,"Warner Brothers, First National Pictures",PG,"Adventure, Action",English,"Feb 11, 1938, Wide",28-Jul-08,,1h 42m,Mono,Flat (1.37:1),"Michael Curtiz, William Keighley, Errol Flynn, Olivia de Havilland, Basil Rathbone, Claude Rains"
I Am Love,81%,68%,Luca Guadagnino,"Luca Guadagnino, Tilda Swinton","Barbara Alberti, Ivan Cotroneo, Walter Fasano, Luca Guadagnino",Magnolia Pictures,RAI Cinema,R (Sexuality|Nudity),"Drama, Romance",Italian,"Jun 18, 2010, Limited",28-Sep-16,$5.0M,1h 59m,,,"Luca Guadagnino, Tilda Swinton, Flavio Parenti, Edoardo Gabbriellini, Alba Rohrwacher, Pippo Delbono"
Secrets & Lies,96%,91%,Mike Leigh,Simon Channing Williams,Mike Leigh,October Films,"Channel Four Films, Thin Man Films",R,Drama,British English,"Oct 25, 1996, Original",15-Oct-20,$13.4M,2h 22m,,,"Mike Leigh, Timothy Spall, Brenda Blethyn, Phyllis Logan, Marianne Jean-Baptiste, Claire Rushbrook"
Armageddon Time,76%,48%,James Gray,"Anthony Katagas, Marc Butan, Rodrigo Teixeira, James Gray",James Gray,Focus Features,"MadRiver Pictures, RT Features, Keep Your Head",R (Some Drug Use Involving Minors|Language),Drama,English,"Nov 4, 2022, Wide",30-Dec-22,$1.8M,1h 54m,Dolby Digital,Digital 2.39:1,"James Gray, Anne Hathaway, Jeremy Strong, Michael Banks Repeta, Jaylin Webb, Tovah Feldshuh"
